{
  "schema_version": "2.0.0",
  "deck_id": "ai-ppt-agent-birth",
  "content_source": {
    "type": "slide-plan",
    "path": "slide-plan.json",
    "schema_version": "1.0.0"
  },
  "source_slide_plan_version": "1.0.0",
  "design_system_id": "ai-ppt-agent-product.v1",
  "ruleset_version": "2.0.0",
  "deck_direction": {
    "communication_mode": "structured-argument",
    "communication_job": "By the end, unspecified audience should 一个优秀的 AI PPT Agent，交付的不只是文件，而是一套能持续改进的演示设计能力。 because 一个优秀的 AI PPT Agent，交付的不只是文件，而是一套能持续改进的演示设计能力。",
    "narrative_arc": [
      "opening",
      "explanation",
      "comparison",
      "explanation",
      "closing"
    ],
    "visual_strategy": "Use evidence-led visuals on 9 of 12 slides; keep visuals subordinate to the slide claim.",
    "hierarchy_strategy": "Create one dominant read per slide, then reveal the primary exhibit and supporting context in a deliberate order.",
    "image_strategy": "Use images as hero, evidence, context, or comparison; define crop and focal placement before layout selection, and avoid decorative thumbnail grids.",
    "layout_strategy": "Choose a composition by communication job, content relationship, and capacity; vary silhouette at narrative beats rather than for decoration.",
    "density_strategy": "Prefer low-to-medium density; shorten, change layout, or split before reducing typography below budget.",
    "rhythm_strategy": "Alternate text-led, visual-led, and transition silhouettes; do not repeat one layout family more than twice."
  },
  "slides": [
    {
      "slide_id": "slide-001",
      "slide_number": 1,
      "slide_type": "cover",
      "layout": {
        "layout_id": "cover.title-subtitle.v1",
        "family": "cover",
        "selection_reason": "supports `cover`; supports `typography`; content item count fits; text fits declared capacity; preserves compatible v1 layout intent",
        "fallback_layout_ids": [],
        "alternatives": []
      },
      "visual_type": "typography",
      "information_density": {
        "level": "medium",
        "content_items": 2,
        "estimated_characters": 39,
        "max_content_items": 2,
        "max_characters": 70,
        "overflow_action": "none"
      },
      "narrative": {
        "communication_job": "一套 AI PPT Agent 如何从想法走向可交付系统？",
        "primary_claim": "把内容理解、设计决策和可编辑渲染拆成协作系统，PPT 才能从生成文本走向生成设计。",
        "entry_logic": "Open the deck and establish the central tension",
        "exit_logic": "Create the need for: 传统制作为什么慢且不稳定？",
        "pacing": "pause"
      },
      "hierarchy": {
        "dominant_element": "primary-claim",
        "reading_order": [
          "primary-claim",
          "supporting-line"
        ],
        "emphasis_levels": 3,
        "deemphasis": "Sources, captions, qualifiers, and repeated context"
      },
      "composition": {
        "silhouette": "single-focal-field",
        "balance": "centered",
        "reading_pattern": "center-out",
        "whitespace": "controlled",
        "grouping": "Group by meaning and relationship; avoid equal card treatment for unrelated content",
        "contrast": "Use scale first, then weight or color; reserve the accent for the decisive point",
        "variation_reason": "Chosen to match this slide's communication job and content relationships"
      },
      "image_strategy": {
        "use_image": false,
        "role": "none",
        "subject": null,
        "aspect_ratio": "auto",
        "focal_position": "auto",
        "crop_intent": "none",
        "treatment": "No decorative image required",
        "fallback": "change-layout"
      },
      "design_notes": [
        "Keep the cover minimal",
        "Create one dominant focal point",
        "Use scale, weight, and whitespace to create hierarchy; do not default to a bullet document",
        "Visual purpose: 把内容理解、设计决策和可编辑渲染拆成协作系统，PPT 才能从生成文本走向生成设计。"
      ],
      "content_refs": [
        "block-001-title",
        "block-001-subtitle"
      ],
      "asset_requirements": [],
      "quality_constraints": [
        "title-must-not-overflow",
        "body-font-at-least-16pt",
        "no-unintended-overlap"
      ]
    },
    {
      "slide_id": "slide-002",
      "slide_number": 2,
      "slide_type": "claim-evidence",
      "layout": {
        "layout_id": "claim-evidence.visual-left.v1",
        "family": "claim-evidence",
        "selection_reason": "supports `claim-evidence`; supports `diagram`; content item count fits; text fits declared capacity",
        "fallback_layout_ids": [
          "content.title-body.v1"
        ],
        "alternatives": []
      },
      "visual_type": "diagram",
      "information_density": {
        "level": "medium",
        "content_items": 4,
        "estimated_characters": 81,
        "max_content_items": 5,
        "max_characters": 190,
        "overflow_action": "none"
      },
      "narrative": {
        "communication_job": "传统制作为什么慢且不稳定？",
        "primary_claim": "资料、叙事、图表、版式和修改相互耦合，让每一次改动都可能牵动整套页面。",
        "entry_logic": "Build from: 把内容理解、设计决策和可编辑渲染拆成协作系统，PPT 才能从生成文本走向生成设计。",
        "exit_logic": "Create the need for: AI Agent 的解决方案是什么？",
        "pacing": "advance"
      },
      "hierarchy": {
        "dominant_element": "primary-exhibit",
        "reading_order": [
          "action-title",
          "primary-exhibit",
          "supporting-context"
        ],
        "emphasis_levels": 2,
        "deemphasis": "Sources, captions, qualifiers, and repeated context"
      },
      "composition": {
        "silhouette": "exhibit-dominant",
        "balance": "asymmetric",
        "reading_pattern": "z-pattern",
        "whitespace": "controlled",
        "grouping": "Group by meaning and relationship; avoid equal card treatment for unrelated content",
        "contrast": "Use scale first, then weight or color; reserve the accent for the decisive point",
        "variation_reason": "Chosen to match this slide's communication job and content relationships"
      },
      "image_strategy": {
        "use_image": false,
        "role": "none",
        "subject": null,
        "aspect_ratio": "auto",
        "focal_position": "auto",
        "crop_intent": "none",
        "treatment": "No decorative image required",
        "fallback": "change-layout"
      },
      "design_notes": [
        "Make the action title state the takeaway",
        "Give the primary exhibit more area than explanatory text",
        "Use a simple directional structure; keep labels concise",
        "Visual purpose: 资料、叙事、图表、版式和修改相互耦合，让每一次改动都可能牵动整套页面。"
      ],
      "content_refs": [
        "block-002-points"
      ],
      "asset_requirements": [],
      "quality_constraints": [
        "title-must-not-overflow",
        "body-font-at-least-16pt",
        "no-unintended-overlap",
        "action-title-must-state-takeaway"
      ]
    },
    {
      "slide_id": "slide-003",
      "slide_number": 3,
      "slide_type": "claim-evidence",
      "layout": {
        "layout_id": "claim-evidence.visual-left.v1",
        "family": "claim-evidence",
        "selection_reason": "supports `claim-evidence`; supports `mixed`; content item count fits; text fits declared capacity; preserves compatible v1 layout intent",
        "fallback_layout_ids": [
          "content.title-body.v1"
        ],
        "alternatives": []
      },
      "visual_type": "mixed",
      "information_density": {
        "level": "medium",
        "content_items": 4,
        "estimated_characters": 81,
        "max_content_items": 5,
        "max_characters": 190,
        "overflow_action": "none"
      },
      "narrative": {
        "communication_job": "AI Agent 的解决方案是什么？",
        "primary_claim": "Agent 不直接堆文字，而是先建立内容语义，再选择视觉表达，最后生成可编辑页面。",
        "entry_logic": "Build from: 资料、叙事、图表、版式和修改相互耦合，让每一次改动都可能牵动整套页面。",
        "exit_logic": "Create the need for: 系统如何分层？",
        "pacing": "advance"
      },
      "hierarchy": {
        "dominant_element": "primary-exhibit",
        "reading_order": [
          "action-title",
          "primary-exhibit",
          "supporting-context"
        ],
        "emphasis_levels": 2,
        "deemphasis": "Sources, captions, qualifiers, and repeated context"
      },
      "composition": {
        "silhouette": "exhibit-dominant",
        "balance": "asymmetric",
        "reading_pattern": "z-pattern",
        "whitespace": "controlled",
        "grouping": "Group by meaning and relationship; avoid equal card treatment for unrelated content",
        "contrast": "Use scale first, then weight or color; reserve the accent for the decisive point",
        "variation_reason": "Chosen to match this slide's communication job and content relationships"
      },
      "image_strategy": {
        "use_image": true,
        "role": "evidence",
        "subject": null,
        "aspect_ratio": "auto",
        "focal_position": "auto",
        "crop_intent": "Preserve the focal subject and leave negative space for the title",
        "treatment": "Use one strong image, not a collage",
        "fallback": "change-layout"
      },
      "design_notes": [
        "Make the action title state the takeaway",
        "Give the primary exhibit more area than explanatory text",
        "Choose one dominant visual and one supporting text region",
        "Visual purpose: Agent 不直接堆文字，而是先建立内容语义，再选择视觉表达，最后生成可编辑页面。"
      ],
      "content_refs": [
        "block-003-points"
      ],
      "asset_requirements": [],
      "quality_constraints": [
        "title-must-not-overflow",
        "body-font-at-least-16pt",
        "no-unintended-overlap",
        "action-title-must-state-takeaway"
      ]
    },
    {
      "slide_id": "slide-004",
      "slide_number": 4,
      "slide_type": "claim-evidence",
      "layout": {
        "layout_id": "content.title-body.v1",
        "family": "claim-evidence",
        "selection_reason": "supports `claim-evidence`; supports `typography`; content item count fits; text fits declared capacity",